{
  "apiVersion": "nexus.io/v1alpha2",
  "kind": "DeploymentModality",
  "metadata": {
    "instance_id": "inst_acmeconsult1",
    "declared_at": "2026-07-19T11:30:00Z"
  },
  "spec": {
    "modality": "byoc",
    "edition": "team",
    "operator": "optional",
    "managed_by": "owner",
    "data_region": "eu-frankfurt"
  }
}
