{
  "apiVersion": "nexus.io/v1alpha2",
  "kind": "DeploymentModality",
  "metadata": {
    "instance_id": "inst_costahomes01",
    "declared_at": "2026-07-19T09:00:00Z"
  },
  "spec": {
    "modality": "managed",
    "edition": "team",
    "operator": "required",
    "managed_by": "ironbat",
    "data_region": "eu-madrid"
  }
}
