{
  "apiVersion": "nexus.io/v1alpha2",
  "kind": "DeploymentModality",
  "metadata": {
    "instance_id": "inst_personal8f3a2c",
    "declared_at": "2026-07-19T09:00:00Z"
  },
  "spec": {
    "modality": "self_hosted",
    "edition": "personal",
    "operator": "absent",
    "managed_by": "owner",
    "data_region": "local"
  }
}
